Symbol,Name,Last Sale,Net Change,% Change,Market Cap,Country,IPO Year,Volume,Sector,Industry
JZXN,Jiuzi Holdings Inc. Ordinary Shares,$1.37,0.085,6.615%,12403977.00,China,2021,1897,Consumer Discretionary,Retail-Auto Dealers and Gas Stations
K,Kellanova Common Stock,$80.55,-0.05,-0.062%,27765415362.00,United States,,1752297,Consumer Staples,Packaged Foods
KACL,Kairous Acquisition Corp. Limited Ordinary Shares,$12.40,0.02,0.162%,0.00,Malaysia,2022,6701,Finance,Blank Checks
KACLR,Kairous Acquisition Corp. Limited Rights,$0.1036,0.00,0.00%,0.00,Malaysia,2022,402,Finance,Blank Checks
KACLW,Kairous Acquisition Corp. Limited Warrants,$0.015,0.0018,13.636%,0.00,Malaysia,2022,2160,Finance,Blank Checks
KAI,Kadant Inc Common Stock,$395.71,-1.57,-0.395%,4647742160.00,United States,1992,76841,Industrials,Industrial Machinery/Components
KALA,KALA BIO Inc. Common Stock,$6.465,-0.135,-2.045%,29804549.00,United States,2017,16144,Health Care,Biotechnology: Pharmaceutical Preparations
KALU,Kaiser Aluminum Corporation Common Stock,$80.07,-0.03,-0.037%,1288166560.00,United States,,110141,Industrials,Metal Fabrications
KALV,KalVista Pharmaceuticals Inc. Common Stock,$9.05,-0.25,-2.688%,391100022.00,United Kingdom,2015,479703,Health Care,Biotechnology: Pharmaceutical Preparations
KAPA,Kairos Pharma Ltd. Common Stock,$1.47,-0.24,-14.035%,18884774.00,,2024,164688,Health Care,Biotechnology: Pharmaceutical Preparations
KAR,OPENLANE Inc. Common Stock,$19.60,-0.27,-1.359%,2094148300.00,United States,2009,506531,Consumer Discretionary,Retail-Auto Dealers and Gas Stations
KARO,Karooooo Ltd. Ordinary Shares,$40.49,0.71,1.785%,1251141000.00,Singapore,2021,16756,Technology,Computer Software: Prepackaged Software
KAVL,Kaival Brands Innovations Group Inc. Common Stock,$0.8899,-0.0021,-0.235%,6037044.00,United States,,79028,Consumer Discretionary,Other Consumer Services
KB,KB Financial Group Inc,$65.85,0.59,0.904%,24935012876.00,South Korea,,97616,Finance,Commercial Banks
KBDC,Kayne Anderson BDC Inc. Common Stock,$16.25,-0.13,-0.794%,0.00,,2024,178459,,
KBH,KB Home Common Stock,$77.82,0.54,0.699%,5706889000.00,United States,1986,947264,Consumer Discretionary,Homebuilding
KBR,KBR Inc. Common Stock,$58.29,0.14,0.241%,7766676180.00,United States,2006,2761866,Industrials,Military/Government/Technical
KC,Kingsoft Cloud Holdings Limited American Depositary Shares,$4.59,0.25,5.76%,1164417147.00,China,2020,2869615,Technology,Computer Software: Prepackaged Software
KD,Kyndryl Holdings Inc. Common Stock,$28.04,-0.02,-0.071%,6512876933.00,United States,2021,2308615,Technology,EDP Services
KDLY,Kindly MD Inc. Common Stock,$0.8277,-0.0624,-7.01%,4947557.00,United States,2024,54468,Health Care,Medical/Nursing Services
KDLYW,Kindly MD Inc. Warrants,$0.10,-0.0101,-9.173%,597748.00,United States,2024,650,Health Care,Medical/Nursing Services
KDP,Keurig Dr Pepper Inc. Common Stock,$31.52,0.28,0.896%,42755419016.00,United States,,10814385,Consumer Staples,Beverages (Production/Distribution)
KE,Kimball Electronics Inc. Common Stock,$19.02,-0.15,-0.782%,469425982.00,United States,,63129,Technology,Electrical Products
KELYA,Kelly Services Inc. Class A Common Stock,$14.16,0.00,0.00%,504235221.00,United States,,379335,Consumer Discretionary,Professional Services
KELYB,Kelly Services Inc. Class B Common Stock,$14.56,-1.5087,-9.389%,518479154.00,United States,,575,Consumer Discretionary,Professional Services
KEN,Kenon Holdings Ltd. Ordinary Shares,$30.31,0.61,2.054%,1599332762.00,Singapore,2015,21283,Utilities,Electric Utilities: Central
KEP,Korea Electric Power Corporation Common Stock,$8.69,0.12,1.40%,11157335658.00,South Korea,1994,76687,Utilities,Electric Utilities: Central
KEQU,Kewaunee Scientific Corporation Common Stock,$41.16,4.55,12.428%,118203617.00,United States,,17065,Industrials,Medical Specialities
KEX,Kirby Corporation Common Stock,$128.30,0.68,0.533%,7364420000.00,United States,,313034,Consumer Discretionary,Marine Transportation
KEY,KeyCorp Common Stock,$19.00,-0.23,-1.196%,18834376734.00,United States,,8823253,Finance,Major Banks
KEY^I,KeyCorp Depositary Shares Each Representing a 1/40th Ownership Interest in a Share of Fixed-to-Floating Rate Perpetual Non-Cumulative Preferred Stock Series E,$24.82,-0.07,-0.281%,,United States,,35404,,
KEY^J,KeyCorp Depositary Shares each representing a 1/40th ownership interest in a share of Fixed Rate Perpetual Non-Cumulative Preferred Stock Series F,$23.10,-0.1164,-0.501%,,United States,,12882,,
KEY^K,KeyCorp Depositary Shares each representing a 1/40th ownership interest in a share of Fixed Rate Perpetual Non-Cumulative Preferred Stock Series G,$23.65,0.00,0.00%,,United States,,41977,,
KEY^L,KeyCorp Depositary Shares each representing a 1/40th ownership interest in a share of Fixed Rate Perpetual Non-Cumulative Preferred Stock Series H,$24.97,0.01,0.04%,,United States,,30958,,
KEYS,Keysight Technologies Inc. Common Stock,$152.13,0.71,0.469%,26401150596.00,United States,2014,2278262,Industrials,Industrial Machinery/Components
KF,Korea Fund Inc. (The) New Common Stock,$20.02,0.08,0.401%,0.00,United States,,27070,Finance,Investment Managers
KFFB,Kentucky First Federal Bancorp Common Stock,$2.63,-0.047,-1.756%,21268060.00,United States,2005,4413,Finance,Savings Institutions
KFRC,Kforce Inc. Common Stock,$57.86,-0.49,-0.84%,1103968800.00,United States,1995,102755,Consumer Discretionary,Professional Services
KFS,Kingsway Financial Services Inc. Common Stock (DE),$8.97,0.15,1.701%,247327935.00,Canada,,62035,Finance,Property-Casualty Insurers
KFY,Korn Ferry Common Stock,$75.57,0.24,0.319%,3930444367.00,United States,1999,272595,Consumer Discretionary,Diversified Commercial Services
KGC,Kinross Gold Corporation Common Stock,$10.00,0.25,2.564%,12290000000.00,Canada,2001,23088535,Basic Materials,Precious Metals
KGEI,Kolibri Global Energy Inc. Common stock,$3.70,0.08,2.21%,132223071.00,United States,,63673,Energy,Oil & Gas Production
KGS,Kodiak Gas Services Inc. Common Stock,$38.47,0.87,2.314%,3368805551.00,United States,2023,725573,Utilities,Natural Gas Distribution
KHC,The Kraft Heinz Company Common Stock,$30.58,-0.49,-1.577%,36976568259.00,United States,,14515351,Consumer Staples,Packaged Foods
KIDS,OrthoPediatrics Corp. Common Stock,$24.32,1.51,6.62%,588931564.00,United States,2017,317042,Health Care,Medical/Dental Instruments
KIM,Kimco Realty Corporation (HC) Common Stock,$25.05,-0.05,-0.199%,16885739245.00,United States,,6329396,Real Estate,Real Estate Investment Trusts
KIM^L,Kimco Realty Corporation Class L Depositary Shares each of which represents a one-one thousandth fractional interest in a share of 5.125% Class L Cumulative Redeemable Preferred Stock liquidation preference $25000.00 per share,$22.2199,-0.1801,-0.804%,,United States,,9385,,
KIM^M,Kimco Realty Corporation Class M Depositary Shares each of which represents a one-one thousandth fractional interest in a share of 5.25% Class M Cumulative Redeemable Preferred Stock liquidation preference $25000.00 per share,$22.77,-0.09,-0.394%,,United States,,9069,,
KIM^N,Kimco Realty Corporation Depositary Shares each representing 1/1000th interest in a share of 7.25% Class N Cumulative Convertible Perpetual Preferred Stock,$62.36,-0.17,-0.272%,,United States,,14292,,
KIND,Nextdoor Holdings Inc. Class A Common Stock,$2.46,0.10,4.237%,940072056.00,United States,,1646470,Technology,Computer Software: Programming Data Processing
KINS,Kingstone Companies Inc. Common Stock,$13.29,0.445,3.464%,164119964.00,United States,,621702,Finance,Property-Casualty Insurers
KIO,KKR Income Opportunities Fund Common Shares,$13.41,0.10,0.751%,0.00,United States,2013,120712,Finance,Investment Managers
KIRK,Kirkland's Inc. COMMONSTOCK,$1.59,-0.01,-0.625%,20847504.00,United States,2002,88631,Consumer Discretionary,Other Specialty Stores
KITT,Nauticus Robotics Inc. Common stock,$0.9102,-0.0057,-0.622%,5832084.00,United States,2021,460074,Industrials,Industrial Machinery/Components
KITTW,Nauticus Robotics Inc. Warrant,$0.0124,0.0016,14.815%,79453.00,United States,2021,94331,Industrials,Industrial Machinery/Components
KKR,KKR & Co. Inc. Common Stock,$152.78,0.33,0.216%,135703612717.00,United States,,2457045,Finance,Investment Managers
KKRS,KKR Group Finance Co. IX LLC 4.625% Subordinated Notes due 2061,$19.23,-0.20,-1.029%,17080641920.00,United States,2021,11606,,
KLAC,KLA Corporation Common Stock,$615.66,-4.60,-0.742%,82350544923.00,United States,1980,1409149,Technology,Electronic Components
KLC,KinderCare Learning Companies Inc. Common Stock,$23.64,0.14,0.596%,2703614344.00,,2024,310582,Consumer Discretionary,Other Consumer Services
KLG,WK Kellogg Co Common Stock,$17.20,0.11,0.644%,1481354197.00,United States,2023,804708,Consumer Staples,Packaged Foods
KLIC,Kulicke and Soffa Industries Inc. Common Stock,$45.58,-0.75,-1.619%,2455451848.00,Singapore,,651310,Technology,Semiconductors
KLTO,Klotho Neurosciences Inc. Common Stock,$0.348,-0.001,-0.287%,5995871.00,United States,2022,194485,Health Care,Biotechnology: Biological Products (No Diagnostic Substances)
KLTOW,Klotho Neurosciences Inc. Warrant,$0.0202,-0.0078,-27.857%,348036.00,United States,2022,9352,Health Care,Biotechnology: Biological Products (No Diagnostic Substances)
KLTR,Kaltura Inc. Common Stock,$2.04,0.04,2.00%,305378451.00,United States,2021,140660,Technology,Computer Software: Prepackaged Software
KLXE,KLX Energy Services Holdings Inc. Common Stock,$5.79,-0.47,-7.508%,97621345.00,United States,,131012,Energy,Oilfield Services/Equipment
KMB,Kimberly-Clark Corporation Common Stock,$135.61,-0.40,-0.294%,45223942211.00,United States,,1771307,Consumer Discretionary,Containers/Packaging
KMDA,Kamada Ltd. Ordinary Shares,$5.91,-0.04,-0.672%,265004400.00,Israel,2013,43231,Health Care,Biotechnology: Pharmaceutical Preparations
KMI,Kinder Morgan Inc. Common Stock,$28.08,0.30,1.08%,62383655272.00,United States,2011,16420721,Utilities,Natural Gas Distribution
KMPB,Kemper Corporation 5.875% Fixed-Rate Reset Junior Subordinated Debentures due 2062,$23.60,-0.23,-0.965%,1511473210.00,United States,2022,32732,Finance,Property-Casualty Insurers
KMPR,Kemper Corporation,$70.60,0.07,0.099%,4521610535.00,United States,,258841,Finance,Property-Casualty Insurers
KMT,Kennametal Inc. Common Stock,$27.97,-0.23,-0.816%,2173992920.00,United States,,598208,Industrials,Industrial Machinery/Components
KMX,CarMax Inc,$75.30,-1.80,-2.335%,11665802877.00,United States,,1727752,Consumer Discretionary,Retail-Auto Dealers and Gas Stations
KN,Knowles Corporation Common Stock,$18.13,0.21,1.172%,1596688849.00,United States,2014,276071,Consumer Staples,Consumer Electronics/Appliances
KNDI,Kandi Technologies Group Inc. Ordinary Shares,$1.105,-0.015,-1.339%,96530849.00,China,,168402,Consumer Discretionary,Auto Manufacturing
KNF,Knife Riv Holding Co. Common Stock,$97.65,2.18,2.283%,5528230643.00,United States,2023,318528,Industrials,Mining & Quarrying of Nonmetallic Minerals (No Fuels)
KNOP,KNOT Offshore Partners LP Common Units representing Limited Partner Interests,$6.18,-0.03,-0.483%,210398601.00,United Kingdom,2013,33407,Consumer Discretionary,Marine Transportation
KNSA,Kiniksa Pharmaceuticals International plc Class A Ordinary Shares,$20.82,-0.68,-3.163%,1503236583.00,United States,2018,309398,Health Care,Biotechnology: Pharmaceutical Preparations
KNSL,Kinsale Capital Group Inc. Common Stock,$469.45,6.70,1.448%,10932541272.00,United States,,114774,Finance,Property-Casualty Insurers
KNTK,Kinetik Holdings Inc. Class A Common Stock,$60.14,0.85,1.434%,9474293643.00,United States,2022,610797,Utilities,Natural Gas Distribution
KNW,Know Labs Inc. Common Stock,$0.2295,0.0102,4.651%,24808476.00,,2022,73007,Industrials,Industrial Machinery/Components
KNX,Knight-Swift Transportation Holdings Inc.,$56.49,0.29,0.516%,9145335570.00,United States,2017,1281496,Industrials,Trucking Freight/Courier Services
KO,Coca-Cola Company (The) Common Stock,$62.59,0.73,1.18%,269625022867.00,United States,,16254832,Consumer Staples,Beverages (Production/Distribution)
KOD,Kodiak Sciences Inc Common Stock,$5.64,-0.02,-0.353%,296798085.00,United States,2018,359053,Health Care,Biotechnology: Biological Products (No Diagnostic Substances)
KODK,Eastman Kodak Company Common New,$5.26,0.69,15.098%,422904000.00,United States,,1868882,Consumer Discretionary,Industrial Machinery/Components
KOF,Coca Cola Femsa S.A.B. de C.V.  American Depositary Shares each representing 10 Units (each Unit consists of 3 Series B Shares and 5 Series L Shares),$78.69,0.85,1.092%,16531449054.00,Mexico,1993,147133,Consumer Staples,Beverages (Production/Distribution)
KOP,Koppers Holdings Inc. Common Stock,$37.37,-1.34,-3.462%,757449802.00,United States,2006,121946,Basic Materials,Forest Products
KOPN,Kopin Corporation Common Stock,$0.8451,0.0181,2.189%,134202387.00,United States,1992,708483,Technology,Semiconductors
KORE,KORE Group Holdings Inc. Common Stock,$1.83,-0.14,-7.107%,33109795.00,United States,,36517,Telecommunications,Telecommunications Equipment
KOS,Kosmos Energy Ltd. Common Shares (DE),$3.91,-0.13,-3.218%,1845111327.00,Bermuda,2011,6504390,Energy,Oil & Gas Production
KOSS,Koss Corporation Common Stock,$6.93,0.15,2.212%,64801009.00,United States,,106895,Consumer Staples,Consumer Electronics/Appliances
KPLT,Katapult Holdings Inc. Common Stock,$6.23,0.07,1.136%,27352933.00,United States,2019,28082,Consumer Discretionary,Diversified Commercial Services
KPLTW,Katapult Holdings Inc. Warrant,$0.008,0.0022,37.931%,35124.00,United States,2019,17943,Consumer Discretionary,Diversified Commercial Services
KPRX,Kiora Pharmaceuticals Inc.  Common Stock,$3.23,0.01,0.311%,9692545.00,United States,,11820,Health Care,Biotechnology: Pharmaceutical Preparations
KPTI,Karyopharm Therapeutics Inc. Common Stock,$0.773,-0.0215,-2.706%,96868113.00,United States,2013,667281,Health Care,Biotechnology: Pharmaceutical Preparations
KR,Kroger Company (The) Common Stock,$58.10,0.04,0.069%,42034552752.00,United States,,6200498,Consumer Staples,Food Chains
KRC,Kilroy Realty Corporation Common Stock,$38.47,0.01,0.026%,4541255549.00,United States,1997,1177304,Real Estate,Real Estate Investment Trusts
KREF,KKR Real Estate Finance Trust Inc. Common Stock,$11.43,0.02,0.175%,795215401.00,United States,2017,586869,Real Estate,Real Estate Investment Trusts
KREF^A,KKR Real Estate Finance Trust Inc. 6.50% Series A Cumulative Redeemable Preferred Stock,$20.55,-0.12,-0.581%,,United States,,27349,,
KRG,Kite Realty Group Trust Common Stock,$27.36,0.42,1.559%,6010065289.00,United States,2004,1183661,Real Estate,Real Estate Investment Trusts
KRKR,36Kr Holdings Inc. American Depositary Shares,$3.31,-0.05,-1.488%,6455443.00,China,2019,11789,Consumer Discretionary,Business Services
KRMD,KORU Medical Systems Inc. Common Stock (DE),$3.31,0.16,5.079%,151721476.00,United States,,34414,Health Care,Medical/Dental Instruments
KRNT,Kornit Digital Ltd. Ordinary Shares,$31.01,0.04,0.129%,1479785819.00,Israel,2015,267558,Industrials,Industrial Machinery/Components
KRNY,Kearny Financial Corp Common Stock,$8.15,0.03,0.369%,526324416.00,United States,2005,201957,Finance,Savings Institutions
KRO,Kronos Worldwide Inc Common Stock,$11.26,-0.06,-0.53%,1295308918.00,United States,,153829,Industrials,Major Chemicals
KRON,Kronos Bio Inc. Common Stock,$0.85,0.0001,0.012%,51289780.00,United States,2020,344088,Health Care,Biotechnology: Pharmaceutical Preparations
KROS,Keros Therapeutics Inc. Common Stock,$53.62,-0.39,-0.722%,2172007271.00,United States,2020,436570,Health Care,Biotechnology: Pharmaceutical Preparations
KRP,Kimbell Royalty Partners Common Units Representing Limited Partner Interests,$15.89,0.01,0.063%,1517396021.00,United States,2017,669316,Energy,Oil & Gas Production
KRRO,Korro Bio Inc. Common Stock,$46.63,0.00,0.00%,436842057.00,United States,2019,94263,Health Care,Biotechnology: Pharmaceutical Preparations
KRT,Karat Packaging Inc. Common Stock,$28.91,-0.29,-0.993%,578896876.00,United States,2021,59010,Industrials,Plastic Products
KRUS,Kura Sushi USA Inc. Class A Common Stock,$85.96,1.49,1.764%,967569886.00,United States,2019,288268,Consumer Discretionary,Restaurants
KRYS,Krystal Biotech Inc. Common Stock,$177.85,2.21,1.258%,5115063462.00,United States,2017,215830,Health Care,Biotechnology: Biological Products (No Diagnostic Substances)
KSCP,Knightscope Inc. Class A Common Stock,$16.87,2.135,14.489%,64417252.00,United States,2022,391125,Telecommunications,Telecommunications Equipment
KSPI,Joint Stock Company Kaspi.kz American Depository Shares,$109.80,-0.41,-0.372%,20788814457.00,Kazakhstan,2024,249626,,
KSS,Kohl's Corporation Common Stock,$17.01,-0.38,-2.185%,1892166120.00,United States,1992,7036927,Consumer Discretionary,Department/Specialty Retail Stores
KT,KT Corporation Common Stock,$15.35,0.08,0.524%,7564892055.00,South Korea,,2795477,Telecommunications,Telecommunications Equipment
KTB,Kontoor Brands Inc. Common Stock ,$90.91,0.25,0.276%,5012911220.00,United States,2019,223589,Consumer Discretionary,Apparel
KTCC,Key Tronic Corporation Common Stock,$5.68,0.03,0.531%,61127427.00,United States,1983,11559,Technology,Electrical Products
KTF,DWS Municipal Income Trust,$10.00,0.00,0.00%,395009380.00,United States,1988,94893,Finance,Finance Companies
KTH,Structures Products Cp 8% CorTS Issued by Peco Energy Cap Tr II Preferred Stock,$28.6001,-0.2061,-0.715%,0.00,United States,,2235,Finance,Finance: Consumer Services
KTN,Structured Products Corp 8.205% CorTS 8.205% Corporate Backed Trust Securities (CorTS),$26.75,0.03,0.112%,0.00,United States,,329,Finance,Finance: Consumer Services
KTOS,Kratos Defense & Security Solutions Inc. Common Stock,$25.05,0.67,2.748%,3784400844.00,United States,,1313167,Industrials,Military/Government/Technical
KTTA,Pasithea Therapeutics Corp. Common Stock,$3.15,-0.05,-1.563%,3989245.00,United States,2021,15121,Health Care,Biotechnology: Pharmaceutical Preparations
KUKE,Kuke Music Holding Limited American Depositary Shares each representing one Ordinary Share,$0.30,0.05,20.00%,9975517.00,,2021,673383,Real Estate,Other Consumer Services
KULR,KULR Technology Group Inc. Common Stock,$0.3275,-0.0175,-5.072%,70159607.00,United States,,6016297,Technology,Electrical Products
KURA,Kura Oncology Inc. Common Stock,$15.96,-0.08,-0.499%,1241109450.00,United States,,620962,Health Care,Biotechnology: Pharmaceutical Preparations
KVAC,Keen Vision Acquisition Corporation Ordinary Shares,$10.88,0.01,0.092%,0.00,United States,2023,100004,,
KVACW,Keen Vision Acquisition Corporation Warrant,$0.0684,0.0046,7.21%,0.00,United States,2023,193406,,
KVHI,KVH Industries Inc. Common Stock,$5.19,0.22,4.427%,102757443.00,United States,1996,49974,Technology,Radio And Television Broadcasting And Communications Equipment
KVUE,Kenvue Inc. Common Stock,$23.69,-0.03,-0.126%,45419828706.00,United States,2023,9838576,Consumer Discretionary,Specialty Chemicals
KVYO,Klaviyo Inc. Series A Common Stock,$34.46,-0.32,-0.92%,9291573822.00,United States,2023,849939,Technology,Computer Software: Prepackaged Software
KW,Kennedy-Wilson Holdings Inc. Common Stock,$11.06,0.31,2.884%,1519775868.00,United States,,317724,Finance,Real Estate
KWE,KWESST Micro Systems Inc. Common Stock,$0.6337,0.0437,7.407%,1000723.00,Canada,,77882,Technology,Computer Software: Prepackaged Software
KWESW,KWESST Micro Systems Inc. Warrant,$0.0297,0.0193,185.577%,46901.00,Canada,,17376,Technology,Computer Software: Prepackaged Software
KWR,Quaker Houghton Common Stock,$163.41,-3.73,-2.232%,2906706522.00,United States,,67922,Industrials,Major Chemicals
KXIN,Kaixin Holdings Ordinary Shares,$2.57,0.21,8.898%,2535523.00,China,2017,548149,Consumer Discretionary,Retail-Auto Dealers and Gas Stations
KYMR,Kymera Therapeutics Inc. Common Stock,$42.84,0.43,1.014%,2774544338.00,United States,2020,376677,Health Care,Biotechnology: Biological Products (No Diagnostic Substances)
KYN,Kayne Anderson Energy Infrastructure Fund Inc.,$13.05,0.14,1.084%,1776516467.00,United States,2004,359580,Finance,Finance/Investors Services
KYTX,Kyverna Therapeutics Inc. Common Stock,$4.08,-0.325,-7.378%,176140177.00,United States,2024,522540,Health Care,Biotechnology: Biological Products (No Diagnostic Substances)
KZIA,Kazia Therapeutics Limited American Depositary Shares,$5.71,0.63,12.402%,19005781.00,Australia,,72947,Health Care,Biotechnology: Pharmaceutical Preparations
KZR,Kezar Life Sciences Inc. Common Stock,$7.38,-0.01,-0.135%,53846118.00,United States,2018,88542,Health Care,Biotechnology: Pharmaceutical Preparations
L,Loews Corporation Common Stock,$84.12,-0.29,-0.344%,18319379201.00,United States,,596001,Finance,Property-Casualty Insurers
LAAC,Lithium Americas (Argentina) Corp. Common Shares,$3.14,0.03,0.965%,506482000.00,Canada,2023,944608,,
LAB,Standard BioTools Inc. Common Stock,$1.51,0.01,0.667%,562110785.00,United States,2011,3307376,Industrials,Biotechnology: Laboratory Analytical Instruments
LAC,Lithium Americas Corp. Common Shares,$3.74,0.12,3.315%,603262000.00,Canada,2023,5279888,Basic Materials,Metal Mining
LAD,Lithia Motors Inc. Common Stock,$370.65,-2.76,-0.739%,9873061871.00,United States,,223082,Consumer Discretionary,Retail-Auto Dealers and Gas Stations
LADR,Ladder Capital Corp Class A Common Stock,$11.64,0.01,0.086%,1485706099.00,United States,2014,426938,Real Estate,Real Estate Investment Trusts
LAES,SEALSQ Corp Ordinary Shares,$0.456,-0.052,-10.236%,10661280.00,Switzerland,,2936115,Technology,Semiconductors
LAKE,Lakeland Industries Inc. Common Stock,$21.58,1.01,4.91%,159618714.00,United States,1986,31108,Health Care,Industrial Specialties
LAMR,Lamar Advertising Company Class A Common Stock,$127.68,0.10,0.078%,13069044798.00,United States,1996,393308,Real Estate,Real Estate Investment Trusts
LANC,Lancaster Colony Corporation Common Stock,$179.62,-0.42,-0.233%,4951225300.00,United States,,131344,Consumer Staples,Packaged Foods
LAND,Gladstone Land Corporation Common Stock,$11.97,0.12,1.013%,433130356.00,United States,1993,286184,Real Estate,Real Estate Investment Trusts
LANDM,Gladstone Land Corporation 5.00% Series D Cumulative Term Preferred Stock,$25.00,0.00,0.00%,904616450.00,United States,,11893,Real Estate,Real Estate Investment Trusts
LANDO,Gladstone Land Corporation 6.00% Series B Cumulative Redeemable Preferred Stock,$21.87,0.18,0.83%,791358470.00,United States,,17539,Real Estate,Real Estate Investment Trusts
LANDP,Gladstone Land Corporation 6.00% Series C Cumulative Redeemable Preferred Stock,$21.78,0.16,0.74%,788101851.00,United States,,25435,Real Estate,Real Estate Investment Trusts
LANV,Lanvin Group Holdings Limited Ordinary Shares,$1.53,-0.22,-12.571%,200385737.00,Cayman Islands,2022,137262,Finance,Blank Checks
LARK,Landmark Bancorp Inc. Common Stock,$23.20,1.17,5.311%,127628327.00,United States,,2522,Finance,Major Banks
LASE,Laser Photonics Corporation Common Stock,$5.30,0.23,4.536%,73311694.00,United States,2022,354679,Miscellaneous,Industrial Machinery/Components
LASR,nLIGHT Inc. Common Stock,$10.87,0.44,4.219%,526427100.00,United States,2018,537448,Technology,Semiconductors
LATG,Chenghe Acquisition I Co. Class A Ordinary Shares,$11.6799,0.0099,0.085%,189798375.00,Mexico,2022,522,Finance,Blank Checks
LAUR,Laureate Education Inc. Common Stock,$18.77,0.10,0.536%,2828356155.00,United States,2017,553851,Real Estate,Other Consumer Services
LAW,CS Disco Inc. Common Stock,$5.44,-0.03,-0.548%,325903687.00,United States,2021,154179,Technology,Computer Software: Prepackaged Software
LAZ,Lazard Inc. Common Stock,$55.00,0.02,0.036%,6202135005.00,Bermuda,2005,579634,Finance,Investment Managers
LAZR,Luminar Technologies Inc.  Class A Common Stock,$0.8001,-0.0648,-7.492%,399603287.00,United States,2019,53272876,Consumer Discretionary,Auto Parts:O.E.M.
LB,LandBridge Company LLC Class A Shares Representing Limited Liability Company Interests,$63.60,-3.10,-4.648%,4652441951.00,,2024,1770431,Energy,Oil & Gas Production
LBGJ,Li Bang International Corporation Inc. Ordinary Shares,$3.99,0.80,25.078%,73894800.00,China,2024,112242,,
LBPH,Longboard Pharmaceuticals Inc. Common Stock,$59.84,0.09,0.151%,2336494868.00,United States,2021,892795,Health Care,Biotechnology: Pharmaceutical Preparations
LBRDA,Liberty Broadband Corporation Class A Common Stock,$86.05,-0.46,-0.532%,12292078489.00,United States,,133802,Telecommunications,Cable & Other Pay Television Services
LBRDK,Liberty Broadband Corporation Class C Common Stock,$86.62,-0.63,-0.722%,12373501902.00,United States,,1446143,Telecommunications,Cable & Other Pay Television Services
LBRDP,Liberty Broadband Corporation Series A Cumulative Redeemable Preferred Stock,$23.8505,-0.0495,-0.207%,3406998466.00,United States,,12097,Telecommunications,Cable & Other Pay Television Services
LBRT,Liberty Energy Inc. Class A common stock,$17.35,-0.37,-2.088%,2835262135.00,United States,2018,2658471,Energy,Oilfield Services/Equipment
LBTYA,Liberty Global Ltd. Class A Common Shares,$12.79,0.63,5.181%,4572993835.00,United Kingdom,,3715610,Telecommunications,Cable & Other Pay Television Services
LBTYB,Liberty Global Ltd. Class B Common Shares,$12.56,0.56,4.667%,4490758606.00,United Kingdom,,5004,Telecommunications,Cable & Other Pay Television Services
LBTYK,Liberty Global Ltd. Class C Common Shares,$12.91,0.62,5.045%,4615899172.00,United Kingdom,,2346547,Telecommunications,Cable & Other Pay Television Services
LC,LendingClub Corporation Common Stock,$15.07,-0.12,-0.79%,1693897989.00,United States,2014,1322504,Finance,Finance: Consumer Services
LCFY,Locafy Limited Ordinary Share,$6.08,0.09,1.503%,8403685.00,Australia,2022,46173,Technology,Computer Software: Programming Data Processing
LCFYW,Locafy Limited Warrant,$7.48,-0.49,-6.148%,10338744.00,Australia,2022,2138,Technology,Computer Software: Programming Data Processing
