Symbol,Name,Last Sale,Net Change,% Change,Market Cap,Country,IPO Year,Volume,Sector,Industry
PSIG,PS International Group Ltd. Ordinary Shares,$0.535,0.001,0.187%,12991371.00,Hong Kong,,27680,Consumer Discretionary,Oil Refining/Marketing
PSMT,PriceSmart Inc. Common Stock,$87.99,0.265,0.302%,2700124581.00,United States,,103369,Consumer Discretionary,Department/Specialty Retail Stores
PSN,Parsons Corporation Common Stock,$94.42,0.05,0.053%,10026454985.00,United States,2019,1524203,Technology,EDP Services
PSNL,Personalis Inc. Common Stock,$3.69,0.10,2.786%,260691430.00,United States,2019,698553,Health Care,Medical Specialities
PSNY,Polestar Automotive Holding UK PLC Class A ADS,$1.02,-0.09,-8.108%,2177914494.00,Sweden,,5535039,Consumer Discretionary,Auto Manufacturing
PSNYW,Polestar Automotive Holding UK PLC Class C-1 ADS (ADW),$0.144,0.003,2.128%,307470281.00,Sweden,,50322,Consumer Discretionary,Auto Manufacturing
PSO,Pearson Plc Common Stock,$15.20,-0.04,-0.262%,10126268333.00,United Kingdom,,824629,Consumer Discretionary,Books
PSQH,PSQ Holdings Inc. Class A Common Stock,$2.28,0.27,13.433%,79257866.00,,2021,622202,Consumer Discretionary,Advertising
PSTG,Pure Storage Inc. Class A Common Stock,$49.90,0.38,0.767%,16351825511.00,United States,2015,2577738,Technology,Electronic Components
PSTL,Postal Realty Trust Inc. Class A Common Stock,$13.92,0.06,0.433%,326470827.00,United States,2019,77847,Real Estate,Real Estate Investment Trusts
PSTV,PLUS THERAPEUTICS Inc. Common Stock ,$1.24,0.05,4.202%,7311453.00,United States,,36948,Health Care,Medical/Dental Instruments
PSTX,Poseida Therapeutics Inc. Common Stock,$2.77,0.10,3.745%,269978116.00,United States,2020,337363,Health Care,Biotechnology: Biological Products (No Diagnostic Substances)
PSX,Phillips 66 Common Stock,$130.94,-0.38,-0.289%,54076809383.00,United States,,2448689,Energy,Integrated oil Companies
PT,Pintec Technology Holdings Limited American Depositary Shares,$0.9403,0.0103,1.108%,14995868.00,China,2018,7707,Technology,Computer Software: Programming Data Processing
PTA,Cohen & Steers Tax-Advantaged Preferred Securities and Income Fund Common Shares of Beneficial Interest,$20.12,0.18,0.903%,1112101955.00,United States,2020,162204,Finance,Trusts Except Educational Religious and Charitable
PTC,PTC Inc. Common Stock,$189.27,0.01,0.005%,22736830972.00,United States,,754674,Technology,Computer Software: Prepackaged Software
PTCT,PTC Therapeutics Inc. Common Stock,$39.36,0.13,0.331%,3035645628.00,United States,2013,819313,Health Care,Biotechnology: Pharmaceutical Preparations
PTEN,Patterson-UTI Energy Inc. Common Stock,$8.11,-0.17,-2.053%,3162546834.00,United States,1993,4668251,Energy,Oil & Gas Production
PTGX,Protagonist Therapeutics Inc. Common Stock,$38.65,-1.74,-4.308%,2303463396.00,United States,2016,3045668,Health Care,Biotechnology: Pharmaceutical Preparations
PTHL,Pheton Holdings Ltd Class A Ordinary Shares,$4.55,-0.09,-1.94%,65975000.00,China,2024,143418,Health Care,Biotechnology: Electromedical & Electrotherapeutic Apparatus
PTIX,Protagenic Therapeutics Inc. Common Stock,$0.5809,0.001,0.172%,3947112.00,United States,,17695,Health Care,Biotechnology: Pharmaceutical Preparations
PTLE,PTL LTD Ordinary Shares,$3.94,0.48,13.873%,49250000.00,Singapore,2024,1176814,Energy,Oil Refining/Marketing
PTLO,Portillo's Inc. Class A Common Stock,$10.73,-0.18,-1.65%,796404335.00,United States,2021,1381692,Consumer Discretionary,Restaurants
PTMN,Portman Ridge Finance Corporation Common Stock,$17.33,0.01,0.058%,159660926.00,United States,2006,127570,Finance,Finance: Consumer Services
PTN,Palatin Technologies Inc. Common Stock,$0.93,-0.02,-2.105%,18179795.00,United States,1999,184372,Health Care,Biotechnology: Pharmaceutical Preparations
PTON,Peloton Interactive Inc. Class A Common Stock,$7.94,0.36,4.749%,3028785961.00,United States,2019,10686076,Consumer Discretionary,Recreational Games/Products/Toys
PTPI,Petros Pharmaceuticals Inc. Common Stock,$0.2511,-0.0114,-4.343%,2514734.00,United States,,87780,Health Care,Biotechnology: Pharmaceutical Preparations
PTVE,Pactiv Evergreen Inc. Common stock,$12.56,0.21,1.70%,2251898477.00,United States,2020,618111,Consumer Discretionary,Containers/Packaging
PTY,Pimco Corporate & Income Opportunity Fund,$14.54,0.03,0.207%,0.00,United States,2002,532536,Finance,Investment Managers
PUBM,PubMatic Inc. Class A Common Stock,$15.49,0.81,5.518%,739906865.00,United States,2020,1209437,Technology,Computer Software: Programming Data Processing
PUK,Prudential Public Limited Company Common Stock,$15.84,-0.34,-2.101%,21421045737.00,United Kingdom,,1144763,Finance,Life Insurance
PULM,Pulmatrix Inc. Common Stock,$5.43,-1.29,-19.196%,19831908.00,United States,2014,547495,Health Care,Biotechnology: Pharmaceutical Preparations
PUMP,ProPetro Holding Corp. Common Stock,$7.77,-0.08,-1.019%,799764126.00,United States,2017,894651,Energy,Oilfield Services/Equipment
PVBC,Provident Bancorp Inc. (MD) Common Stock,$10.975,-0.045,-0.408%,194587222.00,United States,2015,36434,Finance,Banks
PVH,PVH Corp. Common Stock,$98.66,-2.17,-2.152%,5506618909.00,United States,,495250,Consumer Discretionary,Apparel
PVL,Permianville Royalty Trust Trust Units ,$1.54,-0.03,-1.911%,50820000.00,United States,2011,34598,Energy,Oil & Gas Production
PW,Power REIT (MD) Common Stock,$1.101,0.051,4.857%,3732017.00,United States,1998,50645,Real Estate,Real Estate Investment Trusts
PW^A,Power REIT 7.75% Series A Cumulative Perpetual Preferred Stock,$3.435,-0.185,-5.11%,,United States,,1413,,
PWM,Prestige Wealth Inc. Class A Ordinary Shares,$0.9701,-0.1299,-11.809%,8876415.00,Hong Kong,2023,140749,Finance,Finance: Consumer Services
PWOD,Penns Woods Bancorp Inc. Common Stock,$30.53,0.62,2.073%,230334531.00,United States,,20486,Finance,Major Banks
PWP,Perella Weinberg Partners Class A Common Stock,$25.41,-0.06,-0.236%,2240233951.00,United States,2020,823623,Finance,Finance: Consumer Services
PWR,Quanta Services Inc. Common Stock,$330.78,2.37,0.722%,48826963394.00,United States,,823680,Industrials,Engineering & Construction
PWUP,PowerUp Acquisition Corp. Class A Ordinary Shares,$11.50,0.00,0.00%,0.00,United States,2022,18,Finance,Blank Checks
PWUPU,PowerUp Acquisition Corp. Unit,$11.40,0.00,0.00%,0.00,United States,2022,1,Finance,Blank Checks
PWUPW,PowerUp Acquisition Corp. Warrant,$0.02,-0.0011,-5.213%,0.00,United States,2022,275000,Finance,Blank Checks
PX,P10 Inc. Class A Common Stock,$12.30,0.20,1.653%,1372959887.00,United States,2021,691000,Finance,Investment Managers
PXLW,Pixelworks Inc.  Common Stock,$0.7191,-0.081,-10.124%,42382609.00,United States,2000,548359,Technology,Semiconductors
PXS,Pyxis Tankers Inc. Common Stock,$4.11,-0.05,-1.202%,43329868.00,Greece,,7266,Consumer Discretionary,Marine Transportation
PYCR,Paycor HCM Inc. Common Stock,$16.16,-0.26,-1.583%,2903286483.00,United States,2021,636102,Technology,Computer Software: Prepackaged Software
PYN,PIMCO New York Municipal Income Fund III Common Shares of Beneficial Interest,$6.00,-0.0159,-0.264%,0.00,United States,2002,22702,Finance,Investment Managers
PYPD,PolyPid Ltd. Ordinary Shares,$3.60,0.137,3.956%,24492521.00,Israel,2020,14426,Health Care,Biotechnology: Pharmaceutical Preparations
PYPL,PayPal Holdings Inc. Common Stock,$84.09,-0.58,-0.685%,84303490047.00,United States,,12442731,Consumer Discretionary,Business Services
PYT,PPlus Tr GSC-2 Tr Ctf Fltg Rate,$23.00,0.00,0.00%,0.00,United States,,11,Finance,Finance: Consumer Services
PYXS,Pyxis Oncology Inc. Common Stock,$4.16,0.07,1.711%,247377433.00,United States,2021,436792,Health Care,Biotechnology: Pharmaceutical Preparations
PZC,PIMCO California Municipal Income Fund III Common Shares of Beneficial Interest,$7.08,0.02,0.283%,0.00,United States,2002,69162,Finance,Investment Managers
PZG,Paramount Gold Nevada Corp. Common Stock,$0.3881,-0.0208,-5.087%,25656765.00,United States,2015,157233,Basic Materials,Metal Mining
PZZA,Papa John's International Inc. Common Stock,$47.15,-0.70,-1.463%,1539052524.00,United States,1993,1027938,Consumer Discretionary,Restaurants
QBTS,D-Wave Quantum Inc. Common Shares,$1.49,0.05,3.472%,333782095.00,,2022,11297747,Technology,EDP Services
QCOM,QUALCOMM Incorporated Common Stock,$164.71,0.21,0.128%,182992810000.00,United States,1991,6176848,Technology,Radio And Television Broadcasting And Communications Equipment
QCRH,QCR Holdings Inc. Common Stock,$89.29,0.38,0.427%,1506226849.00,United States,,49321,Finance,Major Banks
QD,Qudian Inc. American Depositary Shares each representing one Class A Ordinary Share,$2.45,-0.02,-0.81%,464039435.00,China,2017,290990,Finance,Finance: Consumer Services
QDEL,QuidelOrtho Corporation Common Stock,$38.58,1.19,3.183%,2594764142.00,United States,,520894,Health Care,Biotechnology: In Vitro & In Vivo Diagnostic Substances
QETA,Quetta Acquisition Corporation Common Stock,$10.50,0.00,0.00%,0.00,United States,2023,7940,Finance,Blank Checks
QETAR,Quetta Acquisition Corporation Right,$1.61,-0.07,-4.167%,0.00,United States,2023,3090,Finance,Blank Checks
QFIN,Qifu Technology Inc. American Depositary Shares,$32.365,0.095,0.294%,5024811083.00,China,2018,832623,Finance,Finance: Consumer Services
QGEN,Qiagen N.V. Common Shares,$40.80,-0.19,-0.464%,9310672404.00,Netherlands,,736441,Health Care,Biotechnology: Biological Products (No Diagnostic Substances)
QH,Quhuo Limited American Depository Shares,$1.36,0.05,3.817%,8387965.00,China,2020,41882,Consumer Discretionary,Business Services
QIPT,Quipt Home Medical Corp. Common Shares,$2.45,0.00,0.00%,105570500.00,United States,,94811,Health Care,Misc Health and Biotechnology Services
QLGN,Qualigen Therapeutics Inc. Common Stock,$3.86,0.22,6.044%,2842624.00,United States,2015,74826,Health Care,Biotechnology: Pharmaceutical Preparations
QLYS,Qualys Inc. Common Stock,$141.45,-2.41,-1.675%,5175719435.00,United States,2012,297721,Technology,Computer Software: Prepackaged Software
QMCO,Quantum Corporation Common Stock,$2.98,0.02,0.676%,14448476.00,United States,,34352,Technology,Electronic Components
QMMM,QMMM Holdings Limited Ordinary Shares,$1.27,-0.46,-26.59%,21748750.00,Hong Kong,2024,4542595,Consumer Discretionary,Advertising
QNCX,Quince Therapeutics Inc. Common Stock,$1.77,0.02,1.143%,77882908.00,United States,2019,124600,Health Care,Biotechnology: Biological Products (No Diagnostic Substances)
QNRX,Quoin Pharmaceuticals Ltd. American Depositary Shares,$0.633,0.033,5.50%,3196473.00,Israel,2016,258478,Health Care,Medical/Dental Instruments
QNST,QuinStreet Inc. Common Stock,$21.13,0.57,2.772%,1188836556.00,United States,2010,387861,Consumer Discretionary,Business Services
QNTM,Quantum Biopharma Ltd. Class B Subordinate Voting Shares,$4.95,0.03,0.61%,6437376.00,Canada,,51611,Health Care,Biotechnology: Pharmaceutical Preparations
QQQX,Nuveen NASDAQ 100 Dynamic Overwrite Fund Shares of Beneficial Interest,$25.97,0.065,0.251%,0.00,United States,,96855,Finance,Finance Companies
QRHC,Quest Resource Holding Corporation Common Stock,$6.71,-0.09,-1.324%,138143299.00,United States,,45835,Utilities,Environmental Services
QRTEA,Qurate Retail Inc. Series A Common Stock ,$0.365,-0.0396,-9.787%,144886759.00,United States,,7533947,Consumer Discretionary,Catalog/Specialty Distribution
QRTEB,Qurate Retail Inc. Series B Common Stock ,$3.14,-0.09,-2.786%,1246423075.00,United States,,534,Consumer Discretionary,Catalog/Specialty Distribution
QRTEP,Qurate Retail Inc. 8.0% Fixed Rate Cumulative Redeemable Preferred Stock,$39.22,-1.59,-3.896%,15568379941.00,United States,,54841,Consumer Discretionary,Catalog/Specialty Distribution
QRVO,Qorvo Inc. Common Stock,$66.28,-0.04,-0.06%,6265229543.00,United States,,1343142,Technology,Semiconductors
QS,QuantumScape Corporation Class A Common Stock,$4.95,0.22,4.651%,2536732559.00,United States,2020,9988694,Miscellaneous,Industrial Machinery/Components
QSG,QuantaSing Group Limited American Depositary Shares,$2.83,0.01,0.355%,144649798.00,China,2023,105287,Real Estate,Other Consumer Services
QSI,Quantum-Si Incorporated Class A Common Stock,$0.633,-0.0279,-4.222%,90337235.00,United States,2020,1400333,Industrials,Industrial Machinery/Components
QSIAW,Quantum-Si Incorporated Warrant,$0.0532,0.0032,6.40%,7592324.00,United States,2020,2110,Industrials,Industrial Machinery/Components
QSR,Restaurant Brands International Inc. Common Shares,$69.45,0.54,0.784%,22481485875.00,Canada,2014,1097106,Consumer Discretionary,Restaurants
QTI,QT Imaging Holdings Inc. Common Stock,$0.565,0.055,10.784%,12331393.00,United States,,341801,Health Care,Biotechnology: Electromedical & Electrotherapeutic Apparatus
QTRX,Quanterix Corporation Common Stock,$11.06,-0.12,-1.073%,424472105.00,United States,2017,342778,Industrials,Biotechnology: Laboratory Analytical Instruments
QTTB,Q32 Bio Inc. Common Stock,$29.09,-2.32,-7.386%,354336592.00,United States,2018,90458,Health Care,Biotechnology: Pharmaceutical Preparations
QTWO,Q2 Holdings Inc. Common Stock,$99.61,3.23,3.351%,6016548391.00,United States,2014,561073,Technology,Computer Software: Prepackaged Software
QUAD,Quad Graphics Inc Class A Common Stock,$7.03,-0.04,-0.566%,366395916.00,United States,,178361,Consumer Discretionary,Publishing
QUBT,Quantum Computing Inc. Common Stock,$2.54,0.15,6.276%,251679649.00,United States,,25364166,Technology,Computer Software: Prepackaged Software
QUIK,QuickLogic Corporation Common Stock,$7.05,0.17,2.471%,103684858.00,United States,1999,240414,Technology,Semiconductors
QURE,uniQure N.V. Ordinary Shares,$5.82,-0.36,-5.825%,283685075.00,Netherlands,2014,1115940,Health Care,Biotechnology: Pharmaceutical Preparations
QVCC,QVC Inc. 6.250% Senior Secured Notes due 2068,$12.99,-0.18,-1.367%,13.00,United States,2019,49073,Consumer Discretionary,Catalog/Specialty Distribution
QVCD,QVC Inc. 6.375% Senior Secured Notes due 2067,$13.13,-0.35,-2.596%,13.00,United States,2018,17344,Consumer Discretionary,Catalog/Specialty Distribution
QXO,QXO Inc. Common Stock,$15.90,0.40,2.581%,6509940101.00,United States,,5619094,Technology,EDP Services
R,Ryder System Inc. Common Stock,$159.35,-1.59,-0.988%,6738945442.00,United States,,271408,Consumer Discretionary,Rental/Leasing Companies
RA,Brookfield Real Assets Income Fund Inc. Common Stock,$13.20,0.03,0.228%,0.00,United States,2016,273901,Finance,Investment Managers
RACE,Ferrari N.V. Common Shares,$428.48,-6.50,-1.494%,104442412198.00,Italy,2015,313630,Consumer Discretionary,Auto Manufacturing
RAIL,FreightCar America Inc. Common Stock,$10.84,1.41,14.952%,204810656.00,United States,2005,689053,Industrials,Railroads
RAMP,LiveRamp Holdings Inc. Common Stock,$28.51,0.37,1.315%,1860685478.00,United States,2018,366962,Technology,EDP Services
RAND,Rand Capital Corporation Common Stock,$16.20,0.06,0.372%,41812540.00,United States,,243,Finance,Finance: Consumer Services
RANI,Rani Therapeutics Holdings Inc. Class A Common Stock,$2.055,0.005,0.244%,117728242.00,United States,2021,543950,Health Care,Biotechnology: Pharmaceutical Preparations
RAPP,Rapport Therapeutics Inc. Common Stock,$22.28,0.95,4.454%,814923462.00,United States,2024,69589,Health Care,Biotechnology: Pharmaceutical Preparations
RAPT,RAPT Therapeutics Inc. Common Stock,$1.07,-0.03,-2.727%,37405331.00,United States,2019,473374,Health Care,Biotechnology: Pharmaceutical Preparations
RARE,Ultragenyx Pharmaceutical Inc. Common Stock,$45.13,1.35,3.084%,4167496815.00,United States,2014,1063718,Health Care,Biotechnology: Pharmaceutical Preparations
RAVE,Rave Restaurant Group Inc. Common Stock,$2.82,0.10,3.676%,41486616.00,United States,,57303,Consumer Discretionary,Food Distributors
RAY,Raytech Holding Limited Ordinary Shares,$1.68,-0.04,-2.326%,29589979.00,Hong Kong,2024,5365,Consumer Discretionary,Consumer Electronics/Appliances
RAYA,Erayak Power Solution Group Inc. Class A Ordinary Shares,$1.16,-0.01,-0.855%,14442000.00,China,2022,12007,Consumer Discretionary,Metal Fabrications
RBA,RB Global Inc. Common Stock,$93.60,-0.53,-0.563%,17246174868.00,Canada,,973370,Consumer Discretionary,Business Services
RBB,RBB Bancorp Common Stock,$24.00,0.07,0.293%,424641984.00,United States,2017,52096,Finance,Major Banks
RBBN,Ribbon Communications Inc. Common Stock,$3.87,0.04,1.044%,678734869.00,United States,,218945,Technology,EDP Services
RBC,RBC Bearings Incorporated Common Stock,$322.51,2.38,0.743%,10129832694.00,United States,2022,145964,Industrials,Metal Fabrications
RBCAA,Republic Bancorp Inc. Class A Common Stock,$75.29,0.44,0.588%,1464077143.00,United States,1998,12220,Finance,Major Banks
RBKB,Rhinebeck Bancorp Inc. Common Stock,$9.80,0.04,0.41%,108658549.00,United States,2019,10850,Finance,Banks
RBLX,Roblox Corporation Class A Common Stock,$52.24,1.21,2.371%,34281155969.00,United States,2021,9487447,Technology,Computer Software: Prepackaged Software
RBOT,Vicarious Surgical Inc. Class A Common Stock,$9.28,-0.04,-0.429%,54828272.00,Hong Kong,2020,20709,Health Care,Industrial Specialties
RBRK,Rubrik Inc. Class A Common Stock,$44.21,0.38,0.867%,8030888458.00,United States,2024,756284,Technology,Computer Software: Prepackaged Software
RC,Ready Capital Corporation Common Stock,$7.23,0.04,0.556%,1218476990.00,United States,2013,1474102,Real Estate,Real Estate Investment Trusts
RC^C,Ready Capital Corporation 6.25% Series C Cumulative Convertible Preferred Stock,$18.20,-0.065,-0.356%,,United States,,585,,
RC^E,Ready Capital Corporation 6.50% Series E Cumulative Redeemable Preferred Stock,$18.97,0.0699,0.37%,,United States,,9788,,
RCAT,Red Cat Holdings Inc. Common Stock,$4.74,-0.16,-3.265%,357438840.00,United States,,8084996,Technology,Computer Software: Prepackaged Software
RCB,Ready Capital Corporation 6.20% Senior Notes due 2026,$24.36,-0.14,-0.571%,4105407949.00,United States,2019,1535,Real Estate,Real Estate Investment Trusts
RCC,Ready Capital Corporation 5.75% Senior Notes due 2026,$24.4726,-0.0874,-0.356%,4124384507.00,United States,2021,2058,Real Estate,Real Estate Investment Trusts
RCEL,Avita Medical Inc. Common Stock,$12.96,0.53,4.264%,339780472.00,United States,,89224,Health Care,Medical/Dental Instruments
RCG,RENN Fund Inc Common Stock,$2.35,-0.01,-0.424%,0.00,United States,,3692,Finance,Investment Managers
RCI,Rogers Communication Inc. Common Stock,$35.79,0.08,0.224%,19013958925.00,Canada,,513073,Telecommunications,Cable & Other Pay Television Services
RCKT,Rocket Pharmaceuticals Inc. Common Stock,$13.16,-0.50,-3.66%,1199627239.00,United States,2015,1816655,Health Care,Biotechnology: Pharmaceutical Preparations
RCKTW,Rocket Pharmaceuticals Inc. Warrant,$0.0367,0.00,0.00%,3345465.00,United States,,15,Health Care,Biotechnology: Pharmaceutical Preparations
RCKY,Rocky Brands Inc. Common Stock,$20.91,0.28,1.357%,155859251.00,United States,1993,36051,Consumer Discretionary,Shoe Manufacturing
RCL,Royal Caribbean Cruises Ltd. Common Stock,$234.67,2.91,1.256%,63096952571.00,United States,1993,1387317,Consumer Discretionary,Marine Transportation
RCMT,RCM Technologies Inc. Common Stock,$21.50,-0.52,-2.361%,163336102.00,United States,,99187,Consumer Discretionary,Professional Services
RCON,Recon Technology Ltd. Class A Ordinary Shares,$2.17,0.05,2.358%,32740871.00,China,2009,19597,Energy,Oilfield Services/Equipment
RCS,PIMCO Strategic Income Fund Inc.,$7.69,-0.07,-0.902%,0.00,United States,1994,122902,Finance,Investment Managers
RCUS,Arcus Biosciences Inc. Common Stock,$14.51,0.08,0.554%,1327833447.00,United States,2018,355755,Health Care,Biotechnology: Pharmaceutical Preparations
RDACU,Rising Dragon Acquisition Corp. Unit,$10.06,0.00,0.00%,0.00,China,2024,110,Finance,Blank Checks
RDCM,Radcom Ltd. Ordinary Shares,$11.68,0.14,1.213%,178794310.00,Israel,1997,80293,Technology,Computer peripheral equipment
RDDT,Reddit Inc. Class A Common Stock,$137.16,7.74,5.981%,24082314827.00,United States,2024,6889242,Technology,EDP Services
RDFN,Redfin Corporation Common Stock,$8.12,0.12,1.50%,1006721449.00,United States,2017,4937248,Finance,Real Estate
RDHL,Redhill Biopharma Ltd. American Depositary Shares,$6.85,-0.14,-2.003%,8771692.00,Israel,,11804,Health Care,Biotechnology: Pharmaceutical Preparations
RDI,Reading International Inc Class A Common Stock,$1.27,-0.07,-5.224%,28481254.00,United States,,33084,Consumer Discretionary,Movies/Entertainment
RDIB,Reading International Inc Class B Common Stock,$6.54,0.494,8.171%,146667243.00,United States,,1744,Consumer Discretionary,Movies/Entertainment
RDN,Radian Group Inc. Common Stock,$33.86,-0.21,-0.616%,5042856685.00,United States,,1340225,Finance,Property-Casualty Insurers
RDNT,RadNet Inc. Common Stock,$79.85,0.76,0.961%,5911034949.00,United States,,458110,Health Care,Medical Specialities
RDUS,Radius Recycling Inc. Class A Common Stock,$17.57,-0.09,-0.51%,492653207.00,United States,,161767,Consumer Discretionary,Industrial Specialties
RDVT,Red Violet Inc. Common Stock ,$35.20,1.53,4.544%,485466150.00,United States,,88767,Technology,Computer Software: Prepackaged Software
RDW,Redwire Corporation Common Stock,$11.64,0.83,7.678%,774535738.00,United States,2021,823162,Industrials,Military/Government/Technical
RDWR,Radware Ltd. Ordinary Shares,$22.98,-0.04,-0.174%,958240170.00,Israel,1999,129971,Consumer Discretionary,Business Services
RDY,Dr. Reddy's Laboratories Ltd Common Stock,$14.35,0.25,1.773%,11973435226.00,India,,1007878,Health Care,Biotechnology: Pharmaceutical Preparations
RDZN,Roadzen Inc. Ordinary Shares,$0.80,0.00,0.00%,54752663.00,United States,2022,32798,Finance,Specialty Insurers
RDZNW,Roadzen Inc. Warrants,$0.0485,-0.0015,-3.00%,3319380.00,United States,2022,16349,Finance,Specialty Insurers
REAL,The RealReal Inc. Common Stock,$4.32,0.31,7.731%,473865967.00,United States,2019,2470409,Consumer Discretionary,Other Specialty Stores
REAX,The Real Brokerage Inc. Common Shares,$4.96,0.12,2.479%,969184000.00,Canada,,918315,Finance,Real Estate
REBN,Reborn Coffee Inc. Common Stock,$1.07,0.00,0.00%,4015186.00,United States,2022,30848,Consumer Discretionary,Restaurants
RECT,Rectitude Holdings Ltd Ordinary Shares,$3.50,0.0609,1.771%,50750000.00,Singapore,2024,1773,Consumer Discretionary,Industrial Machinery/Components
REE,REE Automotive Ltd. Class A Ordinary Shares,$6.78,-0.28,-3.966%,76158587.00,Israel,,28473,Consumer Discretionary,Auto Manufacturing
REFI,Chicago Atlantic Real Estate Finance Inc. Common Stock,$15.89,0.09,0.57%,311991919.00,United States,2021,46252,Real Estate,Real Estate Investment Trusts
REFR,Research Frontiers Incorporated Common Stock,$1.96,-0.01,-0.508%,65694863.00,United States,,20663,Miscellaneous,Multi-Sector Companies
REG,Regency Centers Corporation Common Stock,$74.25,0.48,0.651%,13476775653.00,United States,1993,1021234,Real Estate,Real Estate Investment Trusts
REGCO,Regency Centers Corporation 5.875% Series B Cumulative Redeemable Preferred Stock,$23.76,-0.19,-0.793%,4312568209.00,United States,,5761,Real Estate,Real Estate Investment Trusts
REGCP,Regency Centers Corporation 6.25% Series A Cumulative Redeemable Preferred Stock,$24.20,-0.05,-0.206%,4392430583.00,United States,,2272,Real Estate,Real Estate Investment Trusts
REGN,Regeneron Pharmaceuticals Inc. Common Stock,$744.60,-17.40,-2.283%,81823744783.00,United States,1991,979861,Health Care,Biotechnology: Pharmaceutical Preparations
REI,Ring Energy Inc. Common Stock,$1.54,-0.03,-1.911%,305221892.00,United States,,1708824,Energy,Oil & Gas Production
REKR,Rekor Systems Inc. Common Stock,$0.9096,0.0876,10.657%,85343515.00,United States,,1320525,Telecommunications,Telecommunications Equipment
RELI,Reliance Global Group Inc. Common Stock,$1.31,-0.05,-3.676%,2243471.00,United States,,120011,Finance,Specialty Insurers
RELIW,Reliance Global Group Inc. Series A Warrants,$0.0493,0.0142,40.456%,84430.00,United States,,1220,Finance,Specialty Insurers
RELL,Richardson Electronics Ltd. Common Stock,$13.87,0.12,0.873%,199458339.00,United States,1983,56217,Technology,Electronic Components
RELX,RELX PLC PLC American Depositary Shares (Each representing One Ordinary Share),$45.29,0.25,0.555%,84428381991.00,United Kingdom,2015,662013,Consumer Discretionary,Business Services
RELY,Remitly Global Inc. Common Stock,$19.97,0.21,1.063%,3955281385.00,United States,2021,924746,Consumer Discretionary,Business Services
RENB,Renovaro Inc. Common Stock,$0.4732,-0.0207,-4.191%,75105046.00,United States,,293492,Health Care,Biotechnology: Pharmaceutical Preparations
RENE,Cartesian Growth Corporation II Class A Ordinary Shares,$11.62,-0.04,-0.343%,0.00,United States,2022,1118,Finance,Blank Checks
RENEW,Cartesian Growth Corporation II Warrant,$0.085,-0.0025,-2.857%,0.00,United States,2022,10658,Finance,Blank Checks
RENT,Rent the Runway Inc. Class A Common Stock,$9.44,0.08,0.855%,35948653.00,United States,2021,18894,Consumer Discretionary,Other Specialty Stores
REPL,Replimune Group Inc. Common Stock,$10.95,0.18,1.671%,749171012.00,United States,2018,531716,Health Care,Biotechnology: Biological Products (No Diagnostic Substances)
REPX,Riley Exploration Permian Inc. Common Stock,$34.69,-0.19,-0.545%,745240622.00,United States,1999,89815,Energy,Oil & Gas Production
RERE,ATRenew Inc. American Depositary Shares (every three of which representing two Class A ordinary shares),$2.46,-0.01,-0.405%,545382000.00,Cayman Islands,2021,364209,Consumer Discretionary,Other Specialty Stores
RES,RPC Inc. Common Stock,$5.84,-0.02,-0.341%,1255438530.00,United States,,1000351,Energy,Oilfield Services/Equipment
RETO,ReTo Eco-Solutions Inc. Class A Shares,$0.9199,-0.0041,-0.444%,3445199.00,China,2017,21387,Industrials,Industrial Machinery/Components
REVB,Revelation Biosciences Inc. Common Stock,$0.7779,-0.0365,-4.482%,3339101.00,United States,2020,234142,Health Care,Biotechnology: Pharmaceutical Preparations
REVBW,Revelation Biosciences Inc. Warrant,$0.012,0.00,0.00%,51509.00,United States,2020,290,Health Care,Biotechnology: Pharmaceutical Preparations
